<?xml version="1.0" encoding="UTF-8"?>
<palette xmlns:xsd="http://www.w3.org/2001/XMLSchema-instance" xsd:noNamespaceSchemaLocation="palette.xsd">
    <name>Nighthawks by Edward Hopper</name>
    <color>
        <red>119</red>
        <green>52</green>
        <blue>30</blue>
        <hexcode>77341e</hexcode>
    </color>
    <color>
        <red>235</red>
        <green>227</green>
        <blue>135</blue>
        <hexcode>ebe387</hexcode>
    </color>
    <color>
        <red>98</red>
        <green>142</green>
        <blue>113</blue>
        <hexcode>628e71</hexcode>
    </color>
    <color>
        <red>21</red>
        <green>43</green>
        <blue>54</blue>
        <hexcode>152b36</hexcode>
    </color>
    <color>
        <red>33</red>
        <green>40</green>
        <blue>37</blue>
        <hexcode>212825</hexcode>
    </color>
</palette>
