<?xml version="1.0" encoding="UTF-8"?>
<palette xmlns:xsd="http://www.w3.org/2001/XMLSchema-instance" xsd:noNamespaceSchemaLocation="palette.xsd">
    <name>The Nightwatch by Rembrandt</name>
    <color>
        <red>10</red>
        <green>13</green>
        <blue>12</blue>
        <hexcode>0a0d0c</hexcode>
    </color>
    <color>
        <red>245</red>
        <green>220</green>
        <blue>150</blue>
        <hexcode>f5dc96</hexcode>
    </color>
    <color>
        <red>129</red>
        <green>38</green>
        <blue>15</blue>
        <hexcode>81260f</hexcode>
    </color>
    <color>
        <red>36</red>
        <green>28</green>
        <blue>15</blue>
        <hexcode>241c0f</hexcode>
    </color>
    <color>
        <red>42</red>
        <green>44</green>
        <blue>40</blue>
        <hexcode>2a2c28</hexcode>
    </color>
</palette>
