<?xml version="1.0" encoding="UTF-8"?>
<palette xmlns:xsd="http://www.w3.org/2001/XMLSchema-instance" xsd:noNamespaceSchemaLocation="palette.xsd">
<name>Tinkerbell</name>
<color>
<red>201</red>
<green>115</green>
<blue>102</blue>
<hexcode>c97366</hexcode>
</color>
<color>
<red>186</red>
<green>117</green>
<blue>145</blue>
<hexcode>ba7591</hexcode>
</color>
<color>
<red>168</red>
<green>187</green>
<blue>121</blue>
<hexcode>a8bb79</hexcode>
</color>
<color>
<red>95</red>
<green>124</green>
<blue>81</blue>
<hexcode>5f7c51</hexcode>
</color>
<color>
<red>112</red>
<green>143</green>
<blue>158</blue>
<hexcode>708f9e</hexcode>
</color>
<color>
<red>205</red>
<green>101</green>
<blue>78</blue>
<hexcode>cd654e</hexcode>
</color>
<color>
<red>223</red>
<green>220</green>
<blue>216</blue>
<hexcode>dfdcd8</hexcode>
</color>
<color>
<red>194</red>
<green>164</green>
<blue>106</blue>
<hexcode>c2a46a</hexcode>
</color>
<color>
<red>179</red>
<green>141</green>
<blue>110</blue>
<hexcode>b38d6e</hexcode>
</color>
<color>
<red>198</red>
<green>107</green>
<blue>109</blue>
<hexcode>c66b6d</hexcode>
</color>
<color>
<red>215</red>
<green>142</green>
<blue>81</blue>
<hexcode>d78e51</hexcode>
</color>
<color>
<red>58</red>
<green>58</green>
<blue>59</blue>
<hexcode>3a3a3b</hexcode>
</color>
<color>
<red>131</red>
<green>163</green>
<blue>180</blue>
<hexcode>83a3b4</hexcode>
</color>
<color>
<red>173</red>
<green>124</green>
<blue>92</blue>
<hexcode>ad7c5c</hexcode>
</color>
</palette>
