<?xml version="1.0" encoding="UTF-8"?>
<palette xmlns:xsd="http://www.w3.org/2001/XMLSchema-instance" xsd:noNamespaceSchemaLocation="file:/home/jr/Project/Queued/Looks/palette.xsd">
<name>landscape_03</name>
<color>
<red>94</red>
<green>132</green>
<blue>10</blue>
<hexcode>5e840a</hexcode>
</color>
<color>
<red>249</red>
<green>221</green>
<blue>217</blue>
<hexcode>f9ddd9</hexcode>
</color>
<color>
<red>182</red>
<green>218</green>
<blue>218</blue>
<hexcode>b6dada</hexcode>
</color>
<color>
<red>101</red>
<green>196</green>
<blue>202</blue>
<hexcode>65c4ca</hexcode>
</color>
<color>
<red>43</red>
<green>123</green>
<blue>184</blue>
<hexcode>2b7bb8</hexcode>
</color>
</palette>
