<?xml version="1.0" encoding="UTF-8"?>
<palette xmlns:xsd="http://www.w3.org/2001/XMLSchema-instance" xsd:noNamespaceSchemaLocation="file:/home/jr/Project/Queued/Looks/src/main/resources/palette.xsd">
    <name>L Etoile by Edgar Degas</name>
    <color>
        <red>122</red>
        <green>101</green>
        <blue>78</blue>
        <hexcode>7a654e</hexcode>
    </color>
    <color>
        <red>233</red>
        <green>203</green>
        <blue>183</blue>
        <hexcode>e9cbb7</hexcode>
    </color>
    <color>
        <red>172</red>
        <green>113</green>
        <blue>59</blue>
        <hexcode>ac713b</hexcode>
    </color>
    <color>
        <red>120</red>
        <green>129</green>
        <blue>141</blue>
        <hexcode>78818d</hexcode>
    </color>
    <color>
        <red>53</red>
        <green>46</green>
        <blue>35</blue>
        <hexcode>352e23</hexcode>
    </color>
</palette>
