<?xml version="1.0" encoding="UTF-8"?>
<palette xmlns:xsd="http://www.w3.org/2001/XMLSchema-instance" xsd:noNamespaceSchemaLocation="file:/home/jr/Project/Queued/Looks/src/main/resources/palette.xsd">
    <name>Mona Lisa by Leonardo da Vinci</name>
    <color>
        <red>172</red>
        <green>92</green>
        <blue>44</blue>
        <hexcode>ac5c2c</hexcode>
    </color>
    <color>
        <red>200</red>
        <green>163</green>
        <blue>83</blue>
        <hexcode>c8a353</hexcode>
    </color>
    <color>
        <red>40</red>
        <green>25</green>
        <blue>36</blue>
        <hexcode>281924</hexcode>
    </color>
    <color>
        <red>137</red>
        <green>120</green>
        <blue>70</blue>
        <hexcode>897846</hexcode>
    </color>
    <color>
        <red>155</red>
        <green>160</green>
        <blue>104</blue>
        <hexcode>9ba068</hexcode>
    </color>
    <color>
        <red>224</red>
        <green>213</green>
        <blue>193</blue>
        <hexcode>e0d5c1</hexcode>
    </color>
</palette>
