<?xml version="1.0" encoding="UTF-8"?>
<palette xmlns:xsd="http://www.w3.org/2001/XMLSchema-instance" xsd:noNamespaceSchemaLocation="palette.xsd">
<name>Great Wave Off Kanagawa (Kanagawa Oki Nami Ura) by Hokusai</name>
<color>
<red>125</red>
<green>155</green>
<blue>166</blue>
<hexcode>7d9ba6</hexcode>
</color>
<color>
<red>192</red>
<green>183</green>
<blue>168</blue>
<hexcode>c0b7a8</hexcode>
</color>
<color>
<red>221</red>
<green>211</green>
<blue>196</blue>
<hexcode>ddd3c4</hexcode>
</color>
<color>
<red>16</red>
<green>40</green>
<blue>74</blue>
<hexcode>10284a</hexcode>
</color>
<color>
<red>71</red>
<green>75</green>
<blue>78</blue>
<hexcode>474b4e</hexcode>
</color>
</palette>
